LEVEL,Div Num,Div Name,Sch Num,Sch Name,Sch Type,Low Grade,High Grade,Subject,Grade,Test,2018-2019 Pass Rate,2019-2020 Pass Rate,2020-2021 Pass Rate,2018-2019 Adv Pass Rate,2019-2020 Adv Pass Rate,2020-2021 Adv Pass Rate,address,latitude,longitude,geoid_sd
SCH,1,Accomack County,701,Accawmacke Elementary,Elem,PK,5,English: Reading,Gr 3,English Reading,57,NA,50,12,NA,3,Accawmacke Elementary Accomack County,37.6795825,-75.6677586,5100060
SCH,1,Accomack County,80,Chincoteague Elementary,Elem,PK,5,English: Reading,Gr 3,English Reading,85,NA,57,15,NA,3,Chincoteague Elementary Accomack County,37.9377746,-75.3568172,5100060
SCH,1,Accomack County,600,Kegotank Elementary,Elem,PK,5,English: Reading,Gr 3,English Reading,55,NA,48,11,NA,4,Kegotank Elementary Accomack County,37.8557395,-75.5627454,5100060
SCH,1,Accomack County,702,Metompkin Elementary,Elem,PK,5,English: Reading,Gr 3,English Reading,44,NA,46,4,NA,4,Metompkin Elementary Accomack County,37.7799286,-75.6455429,5100060
SCH,1,Accomack County,590,Pungoteague Elementary,Elem,PK,5,English: Reading,Gr 3,English Reading,50,NA,41,4,NA,5,Pungoteague Elementary Accomack County,37.6524717,-75.7924505,5100060
SCH,1,Accomack County,530,Tangier Combined,Combined,KG,12,English: Reading,Gr 3,English Reading,<,NA,60,<,NA,0,Tangier Combined Accomack County,37.8273986,-75.9937663,NA
SCH,2,Albemarle County,160,Agnor-Hurt Elementary,Elem,PK,5,English: Reading,Gr 3,English Reading,61,NA,55,12,NA,9,Agnor-Hurt Elementary Albemarle County,38.0895381,-78.477002,5100090
SCH,2,Albemarle County,1053,Baker-Butler Elem,Elem,PK,5,English: Reading,Gr 3,English Reading,84,NA,75,29,NA,18,Baker-Butler Elem Albemarle County,38.1232476,-78.4206033,5100090
SCH,2,Albemarle County,100,Broadus Wood Elementary,Elem,PK,5,English: Reading,Gr 3,English Reading,77,NA,72,16,NA,18,Broadus Wood Elementary Albemarle County,38.1623126,-78.4899342,5100090
SCH,2,Albemarle County,941,Brownsville Elementary,Elem,PK,5,English: Reading,Gr 3,English Reading,79,NA,89,27,NA,11,Brownsville Elementary Albemarle County,38.0521719,-78.702623,5100090
SCH,2,Albemarle County,340,Crozet Elementary,Elem,KG,5,English: Reading,Gr 3,English Reading,52,NA,62,14,NA,8,Crozet Elementary Albemarle County,38.0746842,-78.6972965,5100090
SCH,2,Albemarle County,10,Hollymead Elementary,Elem,PK,5,English: Reading,Gr 3,English Reading,93,NA,96,31,NA,29,Hollymead Elementary Albemarle County,38.1123927,-78.4393251,5100090
SCH,2,Albemarle County,40,Mary Carr Greer Elementary,Elem,PK,5,English: Reading,Gr 3,English Reading,55,NA,39,10,NA,7,Mary Carr Greer Elementary Albemarle County,38.0789108,-78.5059185,5100090
SCH,2,Albemarle County,250,Meriwether Lewis Elementary,Elem,KG,5,English: Reading,Gr 3,English Reading,82,NA,76,24,NA,24,Meriwether Lewis Elementary Albemarle County,38.0812441,-78.5980706,5100090
SCH,2,Albemarle County,150,Mountain View Elementary,Elem,PK,5,English: Reading,Gr 3,English Reading,60,NA,58,14,NA,8,Mountain View Elementary Albemarle County,37.9963121,-78.4993339,5100090
SCH,2,Albemarle County,540,Red Hill Elementary,Elem,PK,5,English: Reading,Gr 3,English Reading,52,NA,63,17,NA,0,Red Hill Elementary Albemarle County,37.9644813,-78.6351165,5100090
SCH,2,Albemarle County,30,Scottsville Elementary,Elem,PK,5,English: Reading,Gr 3,English Reading,64,NA,76,13,NA,12,Scottsville Elementary Albemarle County,37.8185234,-78.510781,5100090
SCH,2,Albemarle County,920,Stone Robinson Elementary,Elem,PK,5,English: Reading,Gr 3,English Reading,66,NA,74,23,NA,23,Stone Robinson Elementary Albemarle County,38.0109523,-78.3971583,5100090
SCH,2,Albemarle County,240,Stony Point Elementary,Elem,KG,5,English: Reading,Gr 3,English Reading,74,NA,55,37,NA,20,Stony Point Elementary Albemarle County,38.1118873,-78.3694723,5100090
SCH,2,Albemarle County,910,Virginia L. Murray Elementary,Elem,PK,5,English: Reading,Gr 3,English Reading,89,NA,97,45,NA,41,Virginia L. Murray Elementary Albemarle County,38.058077,-78.6125636,5100090
SCH,2,Albemarle County,930,Woodbrook Elementary,Elem,PK,5,English: Reading,Gr 3,English Reading,58,NA,45,9,NA,4,Woodbrook Elementary Albemarle County,38.0872259,-78.4662548,5100090
SCH,101,Alexandria City,120,Charles Barrett Elementary,Elem,PK,5,English: Reading,Gr 3,English Reading,85,NA,58,26,NA,9,Charles Barrett Elementary Alexandria City,38.8420551,-77.0768167,5100120
SCH,101,Alexandria City,160,Cora Kelly School for Math Science and Technology,Elem,PK,5,English: Reading,Gr 3,English Reading,42,NA,25,4,NA,3,Cora Kelly School for Math Science and Technology Alexandria City,38.837417,-77.0575561,5100120
SCH,101,Alexandria City,110,Douglas Macarthur Elementary,Elem,KG,5,English: Reading,Gr 3,English Reading,71,NA,54,19,NA,13,Douglas Macarthur Elementary Alexandria City,38.8164469,-77.1116712,5100120
SCH,101,Alexandria City,350,Ferdinand T. Day Elementary,Elem,KG,5,English: Reading,Gr 3,English Reading,47,NA,29,4,NA,9,Ferdinand T. Day Elementary Alexandria City,38.8317524,-77.1232258,5100120
SCH,101,Alexandria City,100,George Mason Elementary,Elem,KG,5,English: Reading,Gr 3,English Reading,67,NA,61,24,NA,11,George Mason Elementary Alexandria City,38.828478,-77.072952,5100120
SCH,101,Alexandria City,220,James K. Polk Elementary,Elem,KG,5,English: Reading,Gr 3,English Reading,58,NA,39,17,NA,2,James K. Polk Elementary Alexandria City,38.821772,-77.116147,5100120
SCH,101,Alexandria City,90,Jefferson-Houston PK-8 School,Combined,PK,8,English: Reading,Gr 3,English Reading,35,NA,45,7,NA,3,Jefferson-Houston PK-8 School Alexandria City,38.8082258,-77.0543224,5100120
SCH,101,Alexandria City,230,John Adams Elementary,Elem,PK,5,English: Reading,Gr 3,English Reading,59,NA,49,8,NA,6,John Adams Elementary Alexandria City,38.8335445,-77.1258185,5100120
SCH,101,Alexandria City,80,Lyles-Crouch Elementary,Elem,KG,5,English: Reading,Gr 3,English Reading,81,NA,65,31,NA,9,Lyles-Crouch Elementary Alexandria City,38.7993888,-77.0464303,5100120
SCH,101,Alexandria City,30,Mount Vernon Elementary,Elem,PK,5,English: Reading,Gr 3,English Reading,53,NA,50,11,NA,12,Mount Vernon Elementary Alexandria City,38.8284601,-77.059802,5100120
SCH,101,Alexandria City,60,Naomi L. Brooks Elementary,Elem,KG,5,English: Reading,Gr 3,English Reading,68,NA,61,25,NA,12,Naomi L. Brooks Elementary Alexandria City,38.8127348,-77.0648466,5100120
SCH,101,Alexandria City,50,Patrick Henry K-8 School,Combined,KG,8,English: Reading,Gr 3,English Reading,65,NA,43,11,NA,3,Patrick Henry K-8 School Alexandria City,38.8175068,-77.1115087,5100120
SCH,101,Alexandria City,333,Samuel W. Tucker Elementary,Elem,KG,5,English: Reading,Gr 3,English Reading,79,NA,55,16,NA,5,Samuel W. Tucker Elementary Alexandria City,38.8055455,-77.1264052,5100120
SCH,101,Alexandria City,190,William Ramsay Elementary,Elem,KG,5,English: Reading,Gr 3,English Reading,42,NA,19,5,NA,2,William Ramsay Elementary Alexandria City,38.8273625,-77.1312195,5100120
SCH,3,Alleghany County,110,Callaghan Elementary,Elem,KG,5,English: Reading,Gr 3,English Reading,55,NA,50,0,NA,3,Callaghan Elementary Alleghany County,37.8132525,-80.0781372,5100152
SCH,3,Alleghany County,1041,Mountain View Elementary,Elem,KG,5,English: Reading,Gr 3,English Reading,57,NA,55,11,NA,7,Mountain View Elementary Alleghany County,37.8000733,-79.8740139,5100152
SCH,3,Alleghany County,90,Sharon Elementary,Elem,KG,5,English: Reading,Gr 3,English Reading,78,NA,71,4,NA,10,Sharon Elementary Alleghany County,37.8101751,-79.744895,5100152
SCH,4,Amelia County,220,Amelia County Elementary,Elem,PK,5,English: Reading,Gr 3,English Reading,67,NA,57,10,NA,8,Amelia County Elementary Amelia County,37.3353614,-77.9902114,5100180
SCH,5,Amherst County,780,Amelon Elementary,Elem,PK,5,English: Reading,Gr 3,English Reading,69,NA,47,15,NA,7,Amelon Elementary Amherst County,37.4701154,-79.1175993,NA
SCH,5,Amherst County,790,Amherst Elementary,Elem,PK,5,English: Reading,Gr 3,English Reading,87,NA,79,22,NA,12,Amherst Elementary Amherst County,37.587916,-79.0455582,NA
SCH,5,Amherst County,770,Central Elementary,Elem,PK,5,English: Reading,Gr 3,English Reading,69,NA,49,19,NA,9,Central Elementary Amherst County,37.5692329,-79.0361717,NA
SCH,5,Amherst County,760,Elon Elementary,Elem,PK,5,English: Reading,Gr 3,English Reading,84,NA,57,18,NA,2,Elon Elementary Amherst County,37.5137096,-79.1955376,NA
SCH,5,Amherst County,500,Madison Heights Elementary,Elem,PK,5,English: Reading,Gr 3,English Reading,62,NA,54,7,NA,4,Madison Heights Elementary Amherst County,37.4320054,-79.1337998,NA
SCH,5,Amherst County,740,Temperance Elementary,Elem,PK,5,English: Reading,Gr 3,English Reading,78,NA,71,6,NA,0,Temperance Elementary Amherst County,37.6930629,-79.0817803,NA
SCH,6,Appomattox County,110,Appomattox Elementary,Elem,3,5,English: Reading,Gr 3,English Reading,71,NA,63,14,NA,9,Appomattox Elementary Appomattox County,37.3523093,-78.8378305,5100240
SCH,7,Arlington County,350,Abingdon Elementary,Elem,PK,5,English: Reading,Gr 3,English Reading,52,NA,50,12,NA,12,Abingdon Elementary Arlington County,38.8396172,-77.0959883,5100270
SCH,7,Arlington County,160,Alice West Fleet Elementary,Elem,PK,5,English: Reading,Gr 3,English Reading,74,NA,68,30,NA,8,Alice West Fleet Elementary Arlington County,38.8702001,-77.0979407,5100270
SCH,7,Arlington County,470,Arlington Traditional,Elem,PK,5,English: Reading,Gr 3,English Reading,96,NA,89,32,NA,24,Arlington Traditional Arlington County,38.8788678,-77.1461256,5100270
SCH,7,Arlington County,490,Ashlawn Elementary,Elem,PK,5,English: Reading,Gr 3,English Reading,83,NA,84,25,NA,11,Ashlawn Elementary Arlington County,38.8731638,-77.1360151,5100270
SCH,7,Arlington County,150,Barcroft Elementary,Elem,PK,5,English: Reading,Gr 3,English Reading,60,NA,36,6,NA,4,Barcroft Elementary Arlington County,38.8619352,-77.1082263,5100270
SCH,7,Arlington County,250,Barrett Elementary,Elem,PK,5,English: Reading,Gr 3,English Reading,66,NA,36,12,NA,6,Barrett Elementary Arlington County,38.873056,-77.1123519,5100270
SCH,7,Arlington County,615,Campbell Elementary,Elem,PK,5,English: Reading,Gr 3,English Reading,83,NA,57,20,NA,10,Campbell Elementary Arlington County,38.858045,-77.1261426,5100270
SCH,7,Arlington County,380,Cardinal Elementary,Elem,PK,5,English: Reading,Gr 3,English Reading,91,NA,83,30,NA,21,Cardinal Elementary Arlington County,38.8861689,-77.1420598,5100270
SCH,7,Arlington County,90,Carlin Springs Elementary,Elem,PK,5,English: Reading,Gr 3,English Reading,40,NA,21,2,NA,0,Carlin Springs Elementary Arlington County,38.8628238,-77.1323053,5100270
SCH,7,Arlington County,622,Claremont Immersion,Elem,PK,5,English: Reading,Gr 3,English Reading,76,NA,68,21,NA,9,Claremont Immersion Arlington County,38.8477114,-77.1057587,5100270
SCH,7,Arlington County,626,Discovery Elementary,Elem,PK,5,English: Reading,Gr 3,English Reading,80,NA,81,28,NA,15,Discovery Elementary Arlington County,38.9085217,-77.1472935,5100270
SCH,7,Arlington County,200,Dr. Charles R. Drew Elementary,Elem,PK,5,English: Reading,Gr 3,English Reading,72,NA,37,17,NA,2,Dr. Charles R. Drew Elementary Arlington County,38.8484488,-77.0868857,5100270
SCH,7,Arlington County,111,Escuela Key Elementary,Elem,PK,5,English: Reading,Gr 3,English Reading,67,NA,64,29,NA,19,Escuela Key Elementary Arlington County,38.8797222,-77.1218534,5100270
SCH,7,Arlington County,100,Glebe Elementary,Elem,PK,5,English: Reading,Gr 3,English Reading,87,NA,84,42,NA,20,Glebe Elementary Arlington County,38.892637,-77.12128,5100270
SCH,7,Arlington County,614,Hoffman-Boston Elementary,Elem,PK,5,English: Reading,Gr 3,English Reading,68,NA,53,14,NA,10,Hoffman-Boston Elementary Arlington County,38.8615563,-77.0712021,5100270
SCH,7,Arlington County,613,Innovation Elementary,Elem,PK,5,English: Reading,Gr 3,English Reading,93,NA,86,37,NA,27,Innovation Elementary Arlington County,38.89253,-77.0869429,5100270
SCH,7,Arlington County,440,Jamestown Elementary,Elem,PK,5,English: Reading,Gr 3,English Reading,93,NA,87,37,NA,24,Jamestown Elementary Arlington County,38.9171087,-77.1397115,5100270
SCH,7,Arlington County,460,Long Branch Elementary,Elem,PK,5,English: Reading,Gr 3,English Reading,86,NA,77,34,NA,21,Long Branch Elementary Arlington County,38.8749325,-77.0895643,5100270
SCH,7,Arlington County,627,Montessori Public School of Arlington,Elem,PK,5,English: Reading,Gr 3,English Reading,NA,NA,68,NA,NA,19,Montessori Public School of Arlington Arlington County,38.8659095,-77.0893137,5100270
SCH,7,Arlington County,410,Nottingham Elementary,Elem,KG,5,English: Reading,Gr 3,English Reading,91,NA,87,35,NA,29,Nottingham Elementary Arlington County,38.9003391,-77.1507514,5100270
SCH,7,Arlington County,360,Oakridge Elementary,Elem,PK,5,English: Reading,Gr 3,English Reading,76,NA,67,12,NA,18,Oakridge Elementary Arlington County,38.8504041,-77.0702406,5100270
SCH,7,Arlington County,510,Randolph Elementary,Elem,PK,5,English: Reading,Gr 3,English Reading,60,NA,48,16,NA,8,Randolph Elementary Arlington County,38.8563469,-77.0979582,5100270
SCH,7,Arlington County,420,Taylor Elementary,Elem,PK,5,English: Reading,Gr 3,English Reading,93,NA,88,41,NA,19,Taylor Elementary Arlington County,38.906625,-77.1136075,5100270
SCH,7,Arlington County,211,Tuckahoe Elementary,Elem,PK,5,English: Reading,Gr 3,English Reading,95,NA,78,38,NA,20,Tuckahoe Elementary Arlington County,38.892546,-77.159356,5100270
SCH,8,Augusta County,30,Cassell Elementary,Elem,PK,5,English: Reading,Gr 3,English Reading,68,NA,61,18,NA,4,Cassell Elementary Augusta County,38.1307858,-78.8710143,NA
SCH,8,Augusta County,140,Churchville Elementary,Elem,PK,5,English: Reading,Gr 3,English Reading,73,NA,63,10,NA,5,Churchville Elementary Augusta County,38.22249,-79.1600562,NA
SCH,8,Augusta County,370,Craigsville Elementary,Elem,PK,5,English: Reading,Gr 3,English Reading,63,NA,19,6,NA,0,Craigsville Elementary Augusta County,38.0820361,-79.3807154,NA
SCH,8,Augusta County,842,Edward G. Clymore Elementary,Elem,PK,5,English: Reading,Gr 3,English Reading,62,NA,61,18,NA,6,Edward G. Clymore Elementary Augusta County,38.2460771,-78.9769293,NA
SCH,8,Augusta County,843,Guy K. Stump Elementary,Elem,PK,5,English: Reading,Gr 3,English Reading,66,NA,57,15,NA,6,Guy K. Stump Elementary Augusta County,38.0299488,-79.0349299,NA
SCH,8,Augusta County,40,North River Elementary,Elem,PK,5,English: Reading,Gr 3,English Reading,60,NA,60,11,NA,4,North River Elementary Augusta County,38.3147641,-79.0790887,NA
SCH,8,Augusta County,740,Riverheads Elementary,Elem,PK,5,English: Reading,Gr 3,English Reading,74,NA,75,23,NA,12,Riverheads Elementary Augusta County,38.0361053,-79.1408086,NA
SCH,8,Augusta County,440,Stuarts Draft Elementary,Elem,PK,5,English: Reading,Gr 3,English Reading,62,NA,62,16,NA,6,Stuarts Draft Elementary Augusta County,38.0470892,-79.0080547,NA
SCH,8,Augusta County,640,Wilson Elementary,Elem,PK,5,English: Reading,Gr 3,English Reading,64,NA,56,18,NA,6,Wilson Elementary Augusta County,38.1140247,-78.9905805,NA
SCH,9,Bath County,120,Millboro Elementary,Elem,PK,7,English: Reading,Gr 3,English Reading,95,NA,46,33,NA,8,Millboro Elementary Bath County,37.9774448,-79.6064783,5100330
SCH,9,Bath County,150,Valley Elementary,Elem,PK,7,English: Reading,Gr 3,English Reading,65,NA,37,15,NA,5,Valley Elementary Bath County,37.9730899,-79.852354,5100330
SCH,10,Bedford County,480,Bedford Elementary,Elem,2,5,English: Reading,Gr 3,English Reading,66,NA,51,14,NA,8,Bedford Elementary Bedford County,40.0321852,-78.5065024,NA
SCH,10,Bedford County,30,Big Island Elementary,Elem,PK,5,English: Reading,Gr 3,English Reading,73,NA,64,9,NA,8,Big Island Elementary Bedford County,37.5313265,-79.4161246,5100360
SCH,10,Bedford County,160,Boonsboro Elementary,Elem,PK,5,English: Reading,Gr 3,English Reading,80,NA,75,16,NA,14,Boonsboro Elementary Bedford County,37.4528392,-79.2609355,5100360
SCH,10,Bedford County,500,Forest Elementary,Elem,PK,5,English: Reading,Gr 3,English Reading,90,NA,91,27,NA,9,Forest Elementary Bedford County,37.37558,-79.307953,5100360
SCH,10,Bedford County,1214,Goodview Elementary,Elem,PK,5,English: Reading,Gr 3,English Reading,57,NA,53,8,NA,4,Goodview Elementary Bedford County,37.2627348,-79.7807514,5100360
SCH,10,Bedford County,980,Huddleston Elementary,Elem,PK,5,English: Reading,Gr 3,English Reading,65,NA,69,15,NA,0,Huddleston Elementary Bedford County,37.1634355,-79.4715122,5100360
SCH,10,Bedford County,970,Moneta Elementary,Elem,PK,5,English: Reading,Gr 3,English Reading,71,NA,80,21,NA,15,Moneta Elementary Bedford County,37.1857071,-79.6120289,5100360
SCH,10,Bedford County,180,Montvale Elementary,Elem,PK,5,English: Reading,Gr 3,English Reading,66,NA,48,14,NA,6,Montvale Elementary Bedford County,37.3757896,-79.7087631,5100360
SCH,10,Bedford County,610,New London Academy Elementary,Elem,PK,5,English: Reading,Gr 3,English Reading,88,NA,74,27,NA,17,New London Academy Elementary Bedford County,37.3069478,-79.3067252,5100360
SCH,10,Bedford County,1170,Otter River Elementary,Elem,PK,5,English: Reading,Gr 3,English Reading,86,NA,77,31,NA,13,Otter River Elementary Bedford County,37.3652473,-79.4336897,5100360
SCH,10,Bedford County,640,Stewartsville Elementary,Elem,PK,5,English: Reading,Gr 3,English Reading,80,NA,64,11,NA,9,Stewartsville Elementary Bedford County,37.2712147,-79.7904006,5100360
SCH,10,Bedford County,1213,Thomas Jefferson Elementary,Elem,PK,5,English: Reading,Gr 3,English Reading,78,NA,79,19,NA,13,Thomas Jefferson Elementary Bedford County,37.3565403,-79.2883564,5100360
SCH,11,Bland County,250,Bland County Elementary,Elem,PK,6,English: Reading,Gr 3,English Reading,81,NA,80,21,NA,5,Bland County Elementary Bland County,37.1032529,-81.1143357,5100390
SCH,12,Botetourt County,220,Breckinridge Elementary,Elem,PK,5,English: Reading,Gr 3,English Reading,77,NA,83,6,NA,13,Breckinridge Elementary Botetourt County,37.5024255,-79.8731777,5100420
SCH,12,Botetourt County,20,Buchanan Elementary,Elem,PK,5,English: Reading,Gr 3,English Reading,80,NA,77,11,NA,6,Buchanan Elementary Botetourt County,37.5122528,-79.7041015,5100420
SCH,12,Botetourt County,390,Cloverdale Elementary,Elem,KG,5,English: Reading,Gr 3,English Reading,91,NA,88,27,NA,33,Cloverdale Elementary Botetourt County,37.3627314,-79.9007285,5100420
SCH,12,Botetourt County,400,Colonial Elementary,Elem,PK,5,English: Reading,Gr 3,English Reading,83,NA,78,34,NA,7,Colonial Elementary Botetourt County,37.3577071,-79.8166298,5100420
SCH,12,Botetourt County,30,Eagle Rock Elementary,Elem,PK,5,English: Reading,Gr 3,English Reading,85,NA,67,15,NA,17,Eagle Rock Elementary Botetourt County,37.6567541,-79.8110738,5100420
SCH,12,Botetourt County,460,Greenfield Elementary,Elem,PK,5,English: Reading,Gr 3,English Reading,80,NA,75,23,NA,10,Greenfield Elementary Botetourt County,37.4290237,-79.9287109,5100420
SCH,12,Botetourt County,40,Troutville Elementary,Elem,PK,5,English: Reading,Gr 3,English Reading,76,NA,68,17,NA,11,Troutville Elementary Botetourt County,37.4414068,-79.847834,5100420
SCH,102,Bristol City,60,Highland View Elementary,Elem,PK,5,English: Reading,Gr 3,English Reading,56,NA,46,5,NA,0,Highland View Elementary Bristol City,36.6070348,-82.1640849,5100450
SCH,102,Bristol City,100,Joseph Van Pelt Elementary,Elem,PK,5,English: Reading,Gr 3,English Reading,77,NA,66,11,NA,10,Joseph Van Pelt Elementary Bristol City,36.6221804,-82.1391455,5100450
SCH,102,Bristol City,70,Stonewall Jackson Elementary,Elem,PK,5,English: Reading,Gr 3,English Reading,78,NA,59,14,NA,7,Stonewall Jackson Elementary Bristol City,36.597467,-82.2072386,5100450
SCH,102,Bristol City,90,Washington-Lee Elementary,Elem,PK,5,English: Reading,Gr 3,English Reading,94,NA,45,6,NA,0,Washington-Lee Elementary Bristol City,36.6109123,-82.1781045,5100450
SCH,13,Brunswick County,690,Meherrin Powellton Elementary,Elem,PK,5,English: Reading,Gr 3,English Reading,53,NA,53,9,NA,0,Meherrin Powellton Elementary Brunswick County,36.6689624,-77.7973271,5100480
SCH,13,Brunswick County,700,Red Oak-Sturgeon Elementary,Elem,PK,5,English: Reading,Gr 3,English Reading,32,NA,39,8,NA,7,Red Oak-Sturgeon Elementary Brunswick County,36.9067159,-77.8787081,5100480
SCH,13,Brunswick County,720,Totaro Elementary,Elem,PK,5,English: Reading,Gr 3,English Reading,47,NA,34,4,NA,5,Totaro Elementary Brunswick County,36.778717,-77.8716201,5100480
SCH,14,Buchanan County,90,Council Elementary/Middle,Elem,PK,7,English: Reading,Gr 3,English Reading,44,NA,75,6,NA,0,Council Elementary/Middle Buchanan County,37.0831551,-82.0821572,5100510
SCH,14,Buchanan County,120,Hurley Elementary/Middle,Elem,PK,7,English: Reading,Gr 3,English Reading,74,NA,56,12,NA,4,Hurley Elementary/Middle Buchanan County,37.384781,-82.000628,5100510
SCH,14,Buchanan County,1040,Riverview Elementary/Middle,Combined,PK,8,English: Reading,Gr 3,English Reading,61,NA,64,9,NA,3,Riverview Elementary/Middle Buchanan County,37.3088495,-82.1459733,5100510
SCH,14,Buchanan County,1041,Twin Valley Elementary/Middle,Elem,PK,7,English: Reading,Gr 3,English Reading,70,NA,72,13,NA,0,Twin Valley Elementary/Middle Buchanan County,37.2042551,-81.9745936,5100510
SCH,15,Buckingham County,724,Buckingham Co Elementary,Elem,3,5,English: Reading,Gr 3,English Reading,55,NA,42,8,NA,4,Buckingham Co Elementary Buckingham County,37.552965,-78.4837911,5100540
SCH,103,Buena Vista City,40,Enderly Heights Elementary,Elem,3,5,English: Reading,Gr 3,English Reading,64,NA,58,15,NA,3,Enderly Heights Elementary Buena Vista City,37.7141842,-79.3647657,5100560
SCH,16,Campbell County,560,Altavista Elementary,Elem,PK,5,English: Reading,Gr 3,English Reading,78,NA,63,20,NA,9,Altavista Elementary Campbell County,37.132267,-79.28312,5100600
SCH,16,Campbell County,650,Brookneal Elementary,Elem,PK,5,English: Reading,Gr 3,English Reading,76,NA,52,20,NA,9,Brookneal Elementary Campbell County,37.0521182,-78.9445011,5100600
SCH,16,Campbell County,130,Concord Elementary,Elem,PK,5,English: Reading,Gr 3,English Reading,66,NA,63,11,NA,6,Concord Elementary Campbell County,37.3359462,-78.9785228,5100600
SCH,16,Campbell County,690,Leesville Road Elementary,Elem,PK,5,English: Reading,Gr 3,English Reading,80,NA,73,21,NA,13,Leesville Road Elementary Campbell County,37.3277033,-79.2186685,5100600
SCH,16,Campbell County,821,Rustburg Elementary,Elem,PK,5,English: Reading,Gr 3,English Reading,65,NA,55,21,NA,9,Rustburg Elementary Campbell County,37.2687722,-79.1078654,5100600
SCH,16,Campbell County,60,Tomahawk Elementary,Elem,PK,5,English: Reading,Gr 3,English Reading,82,NA,62,20,NA,7,Tomahawk Elementary Campbell County,37.3440651,-79.2374496,5100600
SCH,16,Campbell County,710,Yellow Branch Elementary,Elem,PK,5,English: Reading,Gr 3,English Reading,66,NA,66,24,NA,10,Yellow Branch Elementary Campbell County,37.2524783,-79.1850191,5100600
SCH,17,Caroline County,620,Bowling Green Elementary,Elem,PK,5,English: Reading,Gr 3,English Reading,53,NA,38,11,NA,0,Bowling Green Elementary Caroline County,38.0236048,-77.3421282,5100660
SCH,17,Caroline County,9020,Lewis and Clark Elementary,Elem,PK,5,English: Reading,Gr 3,English Reading,76,NA,68,20,NA,9,Lewis and Clark Elementary Caroline County,38.0196166,-77.5314769,5100660
SCH,17,Caroline County,630,Madison Elementary,Elem,PK,5,English: Reading,Gr 3,English Reading,73,NA,37,22,NA,1,Madison Elementary Caroline County,38.0266189,-77.4902162,5100660
SCH,18,Carroll County,1180,Fancy Gap Elementary,Elem,PK,5,English: Reading,Gr 3,English Reading,95,NA,89,14,NA,5,Fancy Gap Elementary Carroll County,36.6899795,-80.6977233,5100690
SCH,18,Carroll County,1150,Gladesboro Elementary,Elem,PK,5,English: Reading,Gr 3,English Reading,69,NA,69,23,NA,0,Gladesboro Elementary Carroll County,36.687341,-80.6100959,5100690
SCH,18,Carroll County,1210,Gladeville Elementary,Elem,PK,5,English: Reading,Gr 3,English Reading,71,NA,71,5,NA,5,Gladeville Elementary Carroll County,36.6995177,-80.8783634,5100690
SCH,18,Carroll County,1170,Hillsville Elementary,Elem,PK,5,English: Reading,Gr 3,English Reading,76,NA,70,15,NA,9,Hillsville Elementary Carroll County,36.7678031,-80.734865,5100690
SCH,18,Carroll County,1160,Laurel Elementary,Elem,PK,5,English: Reading,Gr 3,English Reading,69,NA,78,15,NA,9,Laurel Elementary Carroll County,36.7972293,-80.8519905,5100690
SCH,18,Carroll County,1130,Oakland Elementary,Elem,PK,5,English: Reading,Gr 3,English Reading,79,NA,43,21,NA,9,Oakland Elementary Carroll County,36.6429023,-80.8379592,5100690
SCH,18,Carroll County,1110,St. Paul,Elem,PK,7,English: Reading,Gr 3,English Reading,66,NA,63,6,NA,2,St. Paul Carroll County,36.6045303,-80.6897811,5100690
SCH,19,Charles City County,80,Charles City County Elementary,Elem,PK,6,English: Reading,Gr 3,English Reading,67,NA,53,16,NA,13,Charles City County Elementary Charles City County,37.3474988,-77.076273,5100720
SCH,20,Charlotte County,470,Bacon District Elementary,Elem,PK,5,English: Reading,Gr 3,English Reading,60,NA,40,12,NA,13,Bacon District Elementary Charlotte County,36.8881638,-78.5657708,5100750
SCH,20,Charlotte County,100,Eureka Elementary,Elem,PK,5,English: Reading,Gr 3,English Reading,89,NA,66,22,NA,9,Eureka Elementary Charlotte County,39.5078289,-115.9638527,NA
SCH,20,Charlotte County,450,Phenix Elementary,Elem,PK,5,English: Reading,Gr 3,English Reading,94,NA,70,26,NA,5,Phenix Elementary Charlotte County,37.0850163,-78.7452285,5100750
SCH,104,Charlottesville City,70,Burnley-Moran Elementary,Elem,PK,4,English: Reading,Gr 3,English Reading,75,NA,61,31,NA,4,Burnley-Moran Elementary Charlottesville City,38.0354386,-78.4628756,5100780
SCH,104,Charlottesville City,50,Clark Elementary,Elem,PK,4,English: Reading,Gr 3,English Reading,65,NA,29,8,NA,3,Clark Elementary Charlottesville City,38.0227573,-78.4743285,5100780
SCH,104,Charlottesville City,90,Greenbrier Elementary,Elem,PK,4,English: Reading,Gr 3,English Reading,71,NA,56,22,NA,12,Greenbrier Elementary Charlottesville City,38.0635376,-78.4707099,5100780
SCH,104,Charlottesville City,120,Jackson-Via Elementary,Elem,PK,4,English: Reading,Gr 3,English Reading,67,NA,51,18,NA,12,Jackson-Via Elementary Charlottesville City,38.0141527,-78.5039172,5100780
